{
  "dataset_name": "eval_engine_mvp",
  "dataset_spec_version": "1.0.0",
  "allowed_domain_tags": ["trajectory"],
  "capability_targets": [
    {
      "target_id": "t_trajectory_email_easy",
      "domain_tags": ["trajectory"],
      "difficulty": "easy",
      "task_type": "trajectory_email_then_answer",
      "quota_weight": 100
    }
  ],
  "defaults": {
    "max_prompt_length": 20000,
    "max_retries_per_stage": 2,
    "seed": 7
  }
}
