{
  "dataset_name": "eval_engine_mvp",
  "dataset_spec_version": "1.0.0",
  "allowed_domain_tags": ["math", "extraction", "classification", "trajectory", "structured", "canonical"],
  "capability_targets": [
    {
      "target_id": "t_add_easy",
      "domain_tags": ["math"],
      "difficulty": "easy",
      "task_type": "json_math_add",
      "quota_weight": 50
    },
    {
      "target_id": "t_email_easy",
      "domain_tags": ["extraction"],
      "difficulty": "easy",
      "task_type": "json_extract_email",
      "quota_weight": 30
    },
    {
      "target_id": "t_sent_easy",
      "domain_tags": ["classification"],
      "difficulty": "easy",
      "task_type": "json_classify_sentiment",
      "quota_weight": 20
    },
    {
      "target_id": "t_trajectory_email_easy",
      "domain_tags": ["trajectory", "extraction"],
      "difficulty": "easy",
      "task_type": "trajectory_email_then_answer",
      "quota_weight": 10
    },
    {
      "target_id": "t_structured_extract_easy",
      "domain_tags": ["structured", "extraction"],
      "difficulty": "easy",
      "task_type": "json_extract_structured",
      "quota_weight": 15
    },
    {
      "target_id": "t_classify_canonical_easy",
      "domain_tags": ["canonical", "classification"],
      "difficulty": "easy",
      "task_type": "json_classify_canonical",
      "quota_weight": 15
    }
  ],
  "defaults": {
    "max_prompt_length": 20000,
    "max_retries_per_stage": 2,
    "seed": 42
  }
}
